2025-06-11T06:54:09.2612433Z ##[section]Starting: Setup Python, Poetry and App Package_Deploy_AZU382ITN18001
2025-06-11T06:54:09.4203688Z ##[section]Starting: Initialize job
2025-06-11T06:54:09.4208369Z Agent name: 'AZU382ITN18001'
2025-06-11T06:54:09.4208871Z Agent machine name: 'AZU382ITN18001'
2025-06-11T06:54:09.4209084Z Current agent version: '4.252.0'
2025-06-11T06:54:09.5149603Z Agent running as: 'ogourari'
2025-06-11T06:54:09.5193194Z Prepare build directory.
2025-06-11T06:54:09.5519869Z Set build variables.
2025-06-11T06:54:09.5536779Z Download all required tasks.
2025-06-11T06:54:09.6265459Z Checking job knob settings.
2025-06-11T06:54:09.6268355Z    Knob: DockerActionRetries = true Source: $(VSTSAGENT_DOCKER_ACTION_RETRIES) 
2025-06-11T06:54:09.6269701Z    Knob: UseGitLongPaths = true Source: $(USE_GIT_LONG_PATHS) 
2025-06-11T06:54:09.6271507Z    Knob: EnableIssueSourceValidation = true Source: $(ENABLE_ISSUE_SOURCE_VALIDATION) 
2025-06-11T06:54:09.6272226Z    Knob: AgentEnablePipelineArtifactLargeChunkSize = true Source: $(AGENT_ENABLE_PIPELINEARTIFACT_LARGE_CHUNK_SIZE) 
2025-06-11T06:54:09.6274519Z    Knob: ContinueAfterCancelProcessTreeKillAttempt = true Source: $(VSTSAGENT_CONTINUE_AFTER_CANCEL_PROCESSTREEKILL_ATTEMPT) 
2025-06-11T06:54:09.6275206Z    Knob: ProcessHandlerSecureArguments = false Source: $(AZP_75787_ENABLE_NEW_LOGIC) 
2025-06-11T06:54:09.6275677Z    Knob: ProcessHandlerSecureArguments = false Source: $(AZP_75787_ENABLE_NEW_LOGIC_LOG) 
2025-06-11T06:54:09.6276136Z    Knob: ProcessHandlerTelemetry = true Source: $(AZP_75787_ENABLE_COLLECT) 
2025-06-11T06:54:09.6276640Z    Knob: UseNewNodeHandlerTelemetry = True Source: $(DistributedTask.Agent.USENEWNODEHANDLERTELEMETRY) 
2025-06-11T06:54:09.6277141Z    Knob: ProcessHandlerEnableNewLogic = true Source: $(AZP_75787_ENABLE_NEW_PH_LOGIC) 
2025-06-11T06:54:09.6277943Z    Knob: EnableResourceMonitorDebugOutput = true Source: $(AZP_ENABLE_RESOURCE_MONITOR_DEBUG_OUTPUT) 
2025-06-11T06:54:09.6278463Z    Knob: EnableResourceUtilizationWarnings = true Source: $(AZP_ENABLE_RESOURCE_UTILIZATION_WARNINGS) 
2025-06-11T06:54:09.6279178Z    Knob: IgnoreVSTSTaskLib = true Source: $(AZP_AGENT_IGNORE_VSTSTASKLIB) 
2025-06-11T06:54:09.6279617Z    Knob: FailJobWhenAgentDies = true Source: $(FAIL_JOB_WHEN_AGENT_DIES) 
2025-06-11T06:54:09.6280192Z    Knob: CheckForTaskDeprecation = true Source: $(AZP_AGENT_CHECK_FOR_TASK_DEPRECATION) 
2025-06-11T06:54:09.6280856Z    Knob: CheckIfTaskNodeRunnerIsDeprecated246 = False Source: $(DistributedTask.Agent.CheckIfTaskNodeRunnerIsDeprecated246) 
2025-06-11T06:54:09.6281491Z    Knob: UseNode20ToStartContainer = True Source: $(DistributedTask.Agent.UseNode20ToStartContainer) 
2025-06-11T06:54:09.6282261Z    Knob: LogTaskNameInUserAgent = true Source: $(AZP_AGENT_LOG_TASKNAME_IN_USERAGENT) 
2025-06-11T06:54:09.6282770Z    Knob: UseFetchFilterInCheckoutTask = true Source: $(AGENT_USE_FETCH_FILTER_IN_CHECKOUT_TASK) 
2025-06-11T06:54:09.6283338Z    Knob: Rosetta2Warning = true Source: $(ROSETTA2_WARNING) 
2025-06-11T06:54:09.6284386Z    Knob: AddForceCredentialsToGitCheckout = True Source: $(DistributedTask.Agent.AddForceCredentialsToGitCheckout) 
2025-06-11T06:54:09.6285123Z    Knob: UseSparseCheckoutInCheckoutTask = true Source: $(AGENT_USE_SPARSE_CHECKOUT_IN_CHECKOUT_TASK) 
2025-06-11T06:54:09.6285382Z Finished checking job knob settings.
2025-06-11T06:54:09.6572002Z Start tracking orphan processes.
2025-06-11T06:54:09.6777501Z ##[section]Finishing: Initialize job
2025-06-11T06:54:09.6843012Z ##[section]Async Command Start: DetectDockerContainer
2025-06-11T06:54:09.6843602Z ##[section]Async Command End: DetectDockerContainer
2025-06-11T06:54:09.6844550Z ##[section]Async Command Start: DetectDockerContainer
2025-06-11T06:54:09.6844880Z ##[section]Async Command End: DetectDockerContainer
2025-06-11T06:54:09.6984219Z ##[section]Starting: Checkout spartax-api@stable to s
2025-06-11T06:54:09.7087018Z ==============================================================================
2025-06-11T06:54:09.7088540Z Task         : Get sources
2025-06-11T06:54:09.7088897Z Description  : Get sources from a repository. Supports Git, TfsVC, and SVN repositories.
2025-06-11T06:54:09.7089437Z Version      : 1.0.0
2025-06-11T06:54:09.7089780Z Author       : Microsoft
2025-06-11T06:54:09.7090152Z Help         : [More Information](https://go.microsoft.com/fwlink/?LinkId=798199)
2025-06-11T06:54:09.7090335Z ==============================================================================
2025-06-11T06:54:10.1059508Z Syncing repository: spartax-api (Git)
2025-06-11T06:54:10.1069733Z ##[command]git version
2025-06-11T06:54:10.1237655Z git version 2.43.0
2025-06-11T06:54:10.1495612Z ##[command]git init "/home/ogourari/azagent-api/_work/3/s"
2025-06-11T06:54:10.1569967Z hint: Using 'master' as the name for the initial branch. This default branch name
2025-06-11T06:54:10.1570546Z hint: is subject to change. To configure the initial branch name to use in all
2025-06-11T06:54:10.1570996Z hint: of your new repositories, which will suppress this warning, call:
2025-06-11T06:54:10.1581484Z hint: 
2025-06-11T06:54:10.1582967Z hint: 	git config --global init.defaultBranch <name>
2025-06-11T06:54:10.1587174Z hint: 
2025-06-11T06:54:10.1587643Z hint: Names commonly chosen instead of 'master' are 'main', 'trunk' and
2025-06-11T06:54:10.1588250Z hint: 'development'. The just-created branch can be renamed via this command:
2025-06-11T06:54:10.1588639Z hint: 
2025-06-11T06:54:10.1595652Z hint: 	git branch -m <name>
2025-06-11T06:54:10.1622620Z Initialized empty Git repository in /home/ogourari/azagent-api/_work/3/s/.git/
2025-06-11T06:54:10.1640331Z ##[command]git remote add origin https://DCM-IT-TAX-DEV@dev.azure.com/DCM-IT-TAX-DEV/spartax-api/_git/spartax-api
2025-06-11T06:54:10.1704033Z ##[command]git sparse-checkout disable
2025-06-11T06:54:10.1771013Z ##[command]git config gc.auto 0
2025-06-11T06:54:10.1837034Z ##[command]git config core.longpaths true
2025-06-11T06:54:10.1883487Z ##[command]git config --get-all http.https://DCM-IT-TAX-DEV@dev.azure.com/DCM-IT-TAX-DEV/spartax-api/_git/spartax-api.extraheader
2025-06-11T06:54:10.1922336Z ##[command]git config --get-all http.extraheader
2025-06-11T06:54:10.1967443Z ##[command]git config --get-regexp .*extraheader
2025-06-11T06:54:10.2009497Z ##[command]git config --get-all http.proxy
2025-06-11T06:54:10.2053771Z ##[command]git config http.version HTTP/1.1
2025-06-11T06:54:10.2118130Z ##[command]git --config-env=http.extraheader=env_var_http.extraheader fetch --force --tags --prune --prune-tags --progress --no-recurse-submodules origin --depth=1  +fcf54bbd5ad614aba3045bf11a6612090d52f71f:refs/remotes/origin/fcf54bbd5ad614aba3045bf11a6612090d52f71f
2025-06-11T06:54:10.9250489Z remote: Azure Repos        
2025-06-11T06:54:11.0899142Z remote: 
2025-06-11T06:54:11.0903164Z remote: Found 214 objects to send. (167 ms)        
2025-06-11T06:54:11.2923148Z Receiving objects:   0% (1/214)
2025-06-11T06:54:11.2928941Z Receiving objects:   1% (3/214)
2025-06-11T06:54:11.2929352Z Receiving objects:   2% (5/214)
2025-06-11T06:54:11.2930785Z Receiving objects:   3% (7/214)
2025-06-11T06:54:11.2931085Z Receiving objects:   4% (9/214)
2025-06-11T06:54:11.2931349Z Receiving objects:   5% (11/214)
2025-06-11T06:54:11.2931771Z Receiving objects:   6% (13/214)
2025-06-11T06:54:11.2932431Z Receiving objects:   7% (15/214)
2025-06-11T06:54:11.2932803Z Receiving objects:   8% (18/214)
2025-06-11T06:54:11.2933095Z Receiving objects:   9% (20/214)
2025-06-11T06:54:11.2933391Z Receiving objects:  10% (22/214)
2025-06-11T06:54:11.2933708Z Receiving objects:  11% (24/214)
2025-06-11T06:54:11.2934095Z Receiving objects:  12% (26/214)
2025-06-11T06:54:11.2934432Z Receiving objects:  13% (28/214)
2025-06-11T06:54:11.2934798Z Receiving objects:  14% (30/214)
2025-06-11T06:54:11.2935150Z Receiving objects:  15% (33/214)
2025-06-11T06:54:11.2935841Z Receiving objects:  16% (35/214)
2025-06-11T06:54:11.2936323Z Receiving objects:  17% (37/214)
2025-06-11T06:54:11.2936685Z Receiving objects:  18% (39/214)
2025-06-11T06:54:11.2937032Z Receiving objects:  19% (41/214)
2025-06-11T06:54:11.2937384Z Receiving objects:  20% (43/214)
2025-06-11T06:54:11.2938196Z Receiving objects:  21% (45/214)
2025-06-11T06:54:11.2938568Z Receiving objects:  22% (48/214)
2025-06-11T06:54:11.2938872Z Receiving objects:  23% (50/214)
2025-06-11T06:54:11.2951529Z Receiving objects:  24% (52/214)
2025-06-11T06:54:11.2951785Z Receiving objects:  25% (54/214)
2025-06-11T06:54:11.2952158Z Receiving objects:  26% (56/214)
2025-06-11T06:54:11.2957527Z Receiving objects:  27% (58/214)
2025-06-11T06:54:11.2958131Z Receiving objects:  28% (60/214)
2025-06-11T06:54:11.2958531Z Receiving objects:  29% (63/214)
2025-06-11T06:54:11.2958888Z Receiving objects:  30% (65/214)
2025-06-11T06:54:11.2959269Z Receiving objects:  31% (67/214)
2025-06-11T06:54:11.2959693Z Receiving objects:  32% (69/214)
2025-06-11T06:54:11.2959953Z Receiving objects:  33% (71/214)
2025-06-11T06:54:11.2960629Z Receiving objects:  34% (73/214)
2025-06-11T06:54:11.2960977Z Receiving objects:  35% (75/214)
2025-06-11T06:54:11.2961310Z Receiving objects:  36% (78/214)
2025-06-11T06:54:11.2961658Z Receiving objects:  37% (80/214)
2025-06-11T06:54:11.2961997Z Receiving objects:  38% (82/214)
2025-06-11T06:54:11.2962334Z Receiving objects:  39% (84/214)
2025-06-11T06:54:11.2962665Z Receiving objects:  40% (86/214)
2025-06-11T06:54:11.2962928Z Receiving objects:  41% (88/214)
2025-06-11T06:54:11.2963194Z Receiving objects:  42% (90/214)
2025-06-11T06:54:11.2963527Z Receiving objects:  43% (93/214)
2025-06-11T06:54:11.2963971Z Receiving objects:  44% (95/214)
2025-06-11T06:54:11.2964324Z Receiving objects:  45% (97/214)
2025-06-11T06:54:11.2964745Z Receiving objects:  46% (99/214)
2025-06-11T06:54:11.2965085Z Receiving objects:  47% (101/214)
2025-06-11T06:54:11.2965424Z Receiving objects:  48% (103/214)
2025-06-11T06:54:11.2965768Z Receiving objects:  49% (105/214)
2025-06-11T06:54:11.2966101Z Receiving objects:  50% (107/214)
2025-06-11T06:54:11.2966445Z Receiving objects:  51% (110/214)
2025-06-11T06:54:11.2966783Z Receiving objects:  52% (112/214)
2025-06-11T06:54:11.2967124Z Receiving objects:  53% (114/214)
2025-06-11T06:54:11.2967474Z Receiving objects:  54% (116/214)
2025-06-11T06:54:11.2967906Z Receiving objects:  55% (118/214)
2025-06-11T06:54:11.2968357Z Receiving objects:  56% (120/214)
2025-06-11T06:54:11.2968695Z Receiving objects:  57% (122/214)
2025-06-11T06:54:11.2969046Z Receiving objects:  58% (125/214)
2025-06-11T06:54:11.2969391Z Receiving objects:  59% (127/214)
2025-06-11T06:54:11.2969668Z Receiving objects:  60% (129/214)
2025-06-11T06:54:11.2978520Z Receiving objects:  61% (131/214)
2025-06-11T06:54:11.2982030Z Receiving objects:  62% (133/214)
2025-06-11T06:54:11.2983377Z Receiving objects:  63% (135/214)
2025-06-11T06:54:11.2983634Z Receiving objects:  64% (137/214)
2025-06-11T06:54:11.2983909Z Receiving objects:  65% (140/214)
2025-06-11T06:54:11.2984144Z Receiving objects:  66% (142/214)
2025-06-11T06:54:11.2984391Z Receiving objects:  67% (144/214)
2025-06-11T06:54:11.2984658Z Receiving objects:  68% (146/214)
2025-06-11T06:54:11.2984905Z Receiving objects:  69% (148/214)
2025-06-11T06:54:11.2985172Z Receiving objects:  70% (150/214)
2025-06-11T06:54:11.2985417Z Receiving objects:  71% (152/214)
2025-06-11T06:54:11.2985663Z Receiving objects:  72% (155/214)
2025-06-11T06:54:11.2985907Z Receiving objects:  73% (157/214)
2025-06-11T06:54:11.2986154Z Receiving objects:  74% (159/214)
2025-06-11T06:54:11.2986388Z Receiving objects:  75% (161/214)
2025-06-11T06:54:11.2986634Z Receiving objects:  76% (163/214)
2025-06-11T06:54:11.2986879Z Receiving objects:  77% (165/214)
2025-06-11T06:54:11.2987123Z Receiving objects:  78% (167/214)
2025-06-11T06:54:11.2987369Z Receiving objects:  79% (170/214)
2025-06-11T06:54:11.2987600Z Receiving objects:  80% (172/214)
2025-06-11T06:54:11.2988307Z Receiving objects:  81% (174/214)
2025-06-11T06:54:11.2988609Z Receiving objects:  82% (176/214)
2025-06-11T06:54:11.2988852Z Receiving objects:  83% (178/214)
2025-06-11T06:54:11.2989104Z Receiving objects:  84% (180/214)
2025-06-11T06:54:11.2989336Z Receiving objects:  85% (182/214)
2025-06-11T06:54:11.2989697Z Receiving objects:  86% (185/214)
2025-06-11T06:54:11.2989943Z Receiving objects:  87% (187/214)
2025-06-11T06:54:11.2990185Z Receiving objects:  88% (189/214)
2025-06-11T06:54:11.2990426Z Receiving objects:  89% (191/214)
2025-06-11T06:54:11.2990658Z Receiving objects:  90% (193/214)
2025-06-11T06:54:11.2990904Z Receiving objects:  91% (195/214)
2025-06-11T06:54:11.2991145Z Receiving objects:  92% (197/214)
2025-06-11T06:54:11.2991388Z Receiving objects:  93% (200/214)
2025-06-11T06:54:11.2991618Z Receiving objects:  94% (202/214)
2025-06-11T06:54:11.2991864Z Receiving objects:  95% (204/214)
2025-06-11T06:54:11.2992107Z Receiving objects:  96% (206/214)
2025-06-11T06:54:11.2992355Z Receiving objects:  97% (208/214)
2025-06-11T06:54:11.2992599Z Receiving objects:  98% (210/214)
2025-06-11T06:54:11.2992830Z Receiving objects:  99% (212/214)
2025-06-11T06:54:11.2993078Z Receiving objects: 100% (214/214)
2025-06-11T06:54:11.2993362Z Receiving objects: 100% (214/214), 428.44 KiB | 13.82 MiB/s, done.
2025-06-11T06:54:11.2993631Z Resolving deltas:   0% (0/47)
2025-06-11T06:54:11.2993866Z Resolving deltas:   2% (1/47)
2025-06-11T06:54:11.2994085Z Resolving deltas:   4% (2/47)
2025-06-11T06:54:11.2994321Z Resolving deltas:   6% (3/47)
2025-06-11T06:54:11.2994554Z Resolving deltas:   8% (4/47)
2025-06-11T06:54:11.2994788Z Resolving deltas:  10% (5/47)
2025-06-11T06:54:11.2995021Z Resolving deltas:  12% (6/47)
2025-06-11T06:54:11.2995240Z Resolving deltas:  14% (7/47)
2025-06-11T06:54:11.2995476Z Resolving deltas:  17% (8/47)
2025-06-11T06:54:11.2995712Z Resolving deltas:  19% (9/47)
2025-06-11T06:54:11.2995947Z Resolving deltas:  21% (10/47)
2025-06-11T06:54:11.2996175Z Resolving deltas:  23% (11/47)
2025-06-11T06:54:11.2996418Z Resolving deltas:  25% (12/47)
2025-06-11T06:54:11.2996661Z Resolving deltas:  27% (13/47)
2025-06-11T06:54:11.2996897Z Resolving deltas:  29% (14/47)
2025-06-11T06:54:11.2997135Z Resolving deltas:  31% (15/47)
2025-06-11T06:54:11.2997357Z Resolving deltas:  34% (16/47)
2025-06-11T06:54:11.2997598Z Resolving deltas:  36% (17/47)
2025-06-11T06:54:11.2997926Z Resolving deltas:  38% (18/47)
2025-06-11T06:54:11.2998169Z Resolving deltas:  40% (19/47)
2025-06-11T06:54:11.2998408Z Resolving deltas:  42% (20/47)
2025-06-11T06:54:11.2998705Z Resolving deltas:  44% (21/47)
2025-06-11T06:54:11.2998941Z Resolving deltas:  46% (22/47)
2025-06-11T06:54:11.2999178Z Resolving deltas:  48% (23/47)
2025-06-11T06:54:11.2999413Z Resolving deltas:  51% (24/47)
2025-06-11T06:54:11.2999635Z Resolving deltas:  53% (25/47)
2025-06-11T06:54:11.2999871Z Resolving deltas:  55% (26/47)
2025-06-11T06:54:11.3000109Z Resolving deltas:  57% (27/47)
2025-06-11T06:54:11.3000340Z Resolving deltas:  59% (28/47)
2025-06-11T06:54:11.3000579Z Resolving deltas:  61% (29/47)
2025-06-11T06:54:11.3000800Z Resolving deltas:  63% (30/47)
2025-06-11T06:54:11.3001036Z Resolving deltas:  65% (31/47)
2025-06-11T06:54:11.3001268Z Resolving deltas:  68% (32/47)
2025-06-11T06:54:11.3001502Z Resolving deltas:  70% (33/47)
2025-06-11T06:54:11.3001740Z Resolving deltas:  72% (34/47)
2025-06-11T06:54:11.3001961Z Resolving deltas:  74% (35/47)
2025-06-11T06:54:11.3002195Z Resolving deltas:  76% (36/47)
2025-06-11T06:54:11.3002429Z Resolving deltas:  78% (37/47)
2025-06-11T06:54:11.3002662Z Resolving deltas:  80% (38/47)
2025-06-11T06:54:11.3002893Z Resolving deltas:  82% (39/47)
2025-06-11T06:54:11.3003112Z Resolving deltas:  85% (40/47)
2025-06-11T06:54:11.3003348Z Resolving deltas:  87% (41/47)
2025-06-11T06:54:11.3003583Z Resolving deltas:  89% (42/47)
2025-06-11T06:54:11.3003819Z Resolving deltas:  91% (43/47)
2025-06-11T06:54:11.3004039Z Resolving deltas:  93% (44/47)
2025-06-11T06:54:11.3004277Z Resolving deltas:  95% (45/47)
2025-06-11T06:54:11.3004652Z Resolving deltas:  97% (46/47)
2025-06-11T06:54:11.3004906Z Resolving deltas: 100% (47/47)
2025-06-11T06:54:11.3005157Z Resolving deltas: 100% (47/47), done.
2025-06-11T06:54:11.5199913Z From https://dev.azure.com/DCM-IT-TAX-DEV/spartax-api/_git/spartax-api
2025-06-11T06:54:11.5213129Z  * [new ref]         fcf54bbd5ad614aba3045bf11a6612090d52f71f -> origin/fcf54bbd5ad614aba3045bf11a6612090d52f71f
2025-06-11T06:54:11.5218582Z  * [new tag]         1.0.1         -> 1.0.1
2025-06-11T06:54:11.5231817Z  * [new tag]         v1.0.0        -> v1.0.0
2025-06-11T06:54:11.5289807Z  * [new tag]         v1.0.0-beta.1 -> v1.0.0-beta.1
2025-06-11T06:54:11.5291072Z  * [new tag]         v1.0.0-beta.2 -> v1.0.0-beta.2
2025-06-11T06:54:11.5292963Z  * [new tag]         v1.0.0-beta.3 -> v1.0.0-beta.3
2025-06-11T06:54:11.6322915Z ##[command]git --config-env=http.extraheader=env_var_http.extraheader fetch --force --tags --prune --prune-tags --progress --no-recurse-submodules origin --depth=1  +fcf54bbd5ad614aba3045bf11a6612090d52f71f
2025-06-11T06:54:11.8669037Z remote: Azure Repos        
2025-06-11T06:54:11.9134260Z remote: 
2025-06-11T06:54:11.9137069Z remote: Found 0 objects to send. (46 ms)        
2025-06-11T06:54:11.9221254Z From https://dev.azure.com/DCM-IT-TAX-DEV/spartax-api/_git/spartax-api
2025-06-11T06:54:11.9231466Z  * branch            fcf54bbd5ad614aba3045bf11a6612090d52f71f -> FETCH_HEAD
2025-06-11T06:54:12.0321741Z ##[command]git checkout --progress --force refs/remotes/origin/fcf54bbd5ad614aba3045bf11a6612090d52f71f
2025-06-11T06:54:12.0327359Z Note: switching to 'refs/remotes/origin/fcf54bbd5ad614aba3045bf11a6612090d52f71f'.
2025-06-11T06:54:12.0327490Z 
2025-06-11T06:54:12.0327738Z You are in 'detached HEAD' state. You can look around, make experimental
2025-06-11T06:54:12.0330537Z changes and commit them, and you can discard any commits you make in this
2025-06-11T06:54:12.0336566Z state without impacting any branches by switching back to a branch.
2025-06-11T06:54:12.0336716Z 
2025-06-11T06:54:12.0337050Z If you want to create a new branch to retain commits you create, you may
2025-06-11T06:54:12.0337331Z do so (now or later) by using -c with the switch command. Example:
2025-06-11T06:54:12.0337450Z 
2025-06-11T06:54:12.0337648Z   git switch -c <new-branch-name>
2025-06-11T06:54:12.0337741Z 
2025-06-11T06:54:12.0338087Z Or undo this operation with:
2025-06-11T06:54:12.0338170Z 
2025-06-11T06:54:12.0338347Z   git switch -
2025-06-11T06:54:12.0338417Z 
2025-06-11T06:54:12.0338671Z Turn off this advice by setting config variable advice.detachedHead to false
2025-06-11T06:54:12.0338788Z 
2025-06-11T06:54:12.0338979Z HEAD is now at fcf54bb Update
2025-06-11T06:54:12.0422172Z ##[section]Finishing: Checkout spartax-api@stable to s
2025-06-11T06:54:12.0458063Z ##[section]Starting: Environment setup & Run DB Migration with Poetry
2025-06-11T06:54:12.0466767Z ==============================================================================
2025-06-11T06:54:12.0466924Z Task         : Bash
2025-06-11T06:54:12.0466997Z Description  : Run a Bash script on macOS, Linux, or Windows
2025-06-11T06:54:12.0467100Z Version      : 3.250.1
2025-06-11T06:54:12.0467194Z Author       : Microsoft Corporation
2025-06-11T06:54:12.0467281Z Help         : https://docs.microsoft.com/azure/devops/pipelines/tasks/utility/bash
2025-06-11T06:54:12.0467430Z ==============================================================================
2025-06-11T06:54:12.3099307Z Generating script.
2025-06-11T06:54:12.3113364Z ========================== Starting Command Output ===========================
2025-06-11T06:54:12.3119371Z [command]/usr/bin/bash /home/ogourari/azagent-api/_work/_temp/85656ac0-8f17-472a-8abc-21ebdab7a708.sh
2025-06-11T06:54:12.3363822Z 📦 Starting prepare environment script...
2025-06-11T06:54:12.3364445Z 📦 Starting Alembic migration...
2025-06-11T06:54:12.3364754Z 🔍 Checking Alembic status and pending migrations...
2025-06-11T06:54:12.3365043Z bash: ./prepare-env.sh: No such file or directory
2025-06-11T06:54:12.3365441Z ❌ Failed to get current revision from Alembic. Database may be unreachable or FLASK_APP misconfigured.
2025-06-11T06:54:12.3365752Z ❌ Aborting migration.
2025-06-11T06:54:12.3366088Z ❌ Failed to get heads revision from Alembic. Please check Alembic configuration.
2025-06-11T06:54:12.3412708Z Could not find platform independent libraries <prefix>
2025-06-11T06:54:12.3413586Z Could not find platform dependent libraries <exec_prefix>
2025-06-11T06:54:12.3413846Z Consider setting $PYTHONHOME to <prefix>[:<exec_prefix>]
2025-06-11T06:54:12.3435296Z Python path configuration:
2025-06-11T06:54:12.3436465Z   PYTHONHOME = (not set)
2025-06-11T06:54:12.3437003Z   PYTHONPATH = (not set)
2025-06-11T06:54:12.3437348Z   program name = '/home/ogourari/.local/share/pypoetry/venv/bin/python'
2025-06-11T06:54:12.3437576Z   isolated = 0
2025-06-11T06:54:12.3438058Z   environment = 1
2025-06-11T06:54:12.3438245Z   user site = 1
2025-06-11T06:54:12.3438460Z   import site = 1
2025-06-11T06:54:12.3438731Z   sys._base_executable = '/home/ogourari/.local/share/pypoetry/venv/bin/python'
2025-06-11T06:54:12.3438982Z   sys.base_prefix = '/usr'
2025-06-11T06:54:12.3439197Z   sys.base_exec_prefix = '/usr'
2025-06-11T06:54:12.3439406Z   sys.platlibdir = 'lib'
2025-06-11T06:54:12.3439660Z   sys.executable = '/home/ogourari/.local/share/pypoetry/venv/bin/python'
2025-06-11T06:54:12.3439908Z   sys.prefix = '/usr'
2025-06-11T06:54:12.3440118Z   sys.exec_prefix = '/usr'
2025-06-11T06:54:12.3444084Z   sys.path = [
2025-06-11T06:54:12.3444329Z     '/usr/lib/python310.zip',
2025-06-11T06:54:12.3444540Z     '/usr/lib/python3.10',
2025-06-11T06:54:12.3444735Z     '/usr/lib/lib-dynload',
2025-06-11T06:54:12.3444911Z   ]
2025-06-11T06:54:12.3445216Z Fatal Python error: init_fs_encoding: failed to get the Python codec of the filesystem encoding
2025-06-11T06:54:12.3445490Z Python runtime state: core initialized
2025-06-11T06:54:12.3445742Z ModuleNotFoundError: No module named 'encodings'
2025-06-11T06:54:12.3445840Z 
2025-06-11T06:54:12.3446077Z Current thread 0x000078a30882a080 (most recent call first):
2025-06-11T06:54:12.3446305Z   <no Python frame>
2025-06-11T06:54:12.3501992Z Could not find platform independent libraries <prefix>
2025-06-11T06:54:12.3504516Z Could not find platform dependent libraries <exec_prefix>
2025-06-11T06:54:12.3504778Z Consider setting $PYTHONHOME to <prefix>[:<exec_prefix>]
2025-06-11T06:54:12.3512917Z Python path configuration:
2025-06-11T06:54:12.3516955Z   PYTHONHOME = (not set)
2025-06-11T06:54:12.3517175Z   PYTHONPATH = (not set)
2025-06-11T06:54:12.3517443Z   program name = '/home/ogourari/.local/share/pypoetry/venv/bin/python'
2025-06-11T06:54:12.3517666Z   isolated = 0
2025-06-11T06:54:12.3520216Z   environment = 1
2025-06-11T06:54:12.3520781Z   user site = 1
2025-06-11T06:54:12.3520972Z   import site = 1
2025-06-11T06:54:12.3521244Z   sys._base_executable = '/home/ogourari/.local/share/pypoetry/venv/bin/python'
2025-06-11T06:54:12.3521494Z   sys.base_prefix = '/usr'
2025-06-11T06:54:12.3521710Z   sys.base_exec_prefix = '/usr'
2025-06-11T06:54:12.3521917Z   sys.platlibdir = 'lib'
2025-06-11T06:54:12.3522182Z   sys.executable = '/home/ogourari/.local/share/pypoetry/venv/bin/python'
2025-06-11T06:54:12.3522407Z   sys.prefix = '/usr'
2025-06-11T06:54:12.3522613Z   sys.exec_prefix = '/usr'
2025-06-11T06:54:12.3522802Z   sys.path = [
2025-06-11T06:54:12.3523008Z     '/usr/lib/python310.zip',
2025-06-11T06:54:12.3523216Z     '/usr/lib/python3.10',
2025-06-11T06:54:12.3523419Z     '/usr/lib/lib-dynload',
2025-06-11T06:54:12.3523577Z   ]
2025-06-11T06:54:12.3523860Z Fatal Python error: init_fs_encoding: failed to get the Python codec of the filesystem encoding
2025-06-11T06:54:12.3524135Z Python runtime state: core initialized
2025-06-11T06:54:12.3524390Z ModuleNotFoundError: No module named 'encodings'
2025-06-11T06:54:12.3524487Z 
2025-06-11T06:54:12.3524721Z Current thread 0x0000775f454ce080 (most recent call first):
2025-06-11T06:54:12.3524946Z   <no Python frame>
2025-06-11T06:54:12.3543719Z ❌ Revision values are empty despite Alembic being available. Aborting pipeline.
2025-06-11T06:54:12.3544096Z ✅ No migration required. Current revision matches latest: 
2025-06-11T06:54:12.3544424Z 🧹 Cleaning up non-essential files and folders...
2025-06-11T06:54:12.3713384Z ✅ Cleanup complete.
2025-06-11T06:54:12.3749117Z 📂 pyproject.toml: ./pyproject.toml
2025-06-11T06:54:12.3781190Z 📂 poetry.lock:    ./poetry.lock
2025-06-11T06:54:12.3783180Z 📦 Creating cleaned zip archive...
2025-06-11T06:54:12.4024959Z updating: deploy.sh (deflated 70%)
2025-06-11T06:54:12.4025602Z updating: pyproject.toml (deflated 48%)
2025-06-11T06:54:12.4028911Z updating: gunicorn.config.py (deflated 52%)
2025-06-11T06:54:12.4031907Z updating: favicon.ico (deflated 94%)
2025-06-11T06:54:12.4032506Z updating: azure-pipelines.yaml (deflated 44%)
2025-06-11T06:54:12.4039924Z updating: postman.json (deflated 83%)
2025-06-11T06:54:12.4042799Z updating: api.code-workspace (deflated 59%)
2025-06-11T06:54:12.4043353Z updating: app/ (stored 0%)
2025-06-11T06:54:12.4046664Z updating: app/resource_access.py (deflated 71%)
2025-06-11T06:54:12.4047467Z updating: app/models/ (stored 0%)
2025-06-11T06:54:12.4049792Z updating: app/models/request.py (deflated 76%)
2025-06-11T06:54:12.4053421Z updating: app/models/company.py (deflated 74%)
2025-06-11T06:54:12.4056707Z updating: app/models/pushlog.py (deflated 67%)
2025-06-11T06:54:12.4057355Z updating: app/models/person.py (deflated 68%)
2025-06-11T06:54:12.4062706Z updating: app/models/coc.py (deflated 72%)
2025-06-11T06:54:12.4065699Z updating: app/models/document.py (deflated 78%)
2025-06-11T06:54:12.4070593Z updating: app/models/user.py (deflated 74%)
2025-06-11T06:54:12.4075593Z updating: app/main.py (deflated 72%)
2025-06-11T06:54:12.4077112Z updating: app/constants.py (deflated 35%)
2025-06-11T06:54:12.4077517Z updating: app/enums/ (stored 0%)
2025-06-11T06:54:12.4077998Z updating: app/enums/mail/ (stored 0%)
2025-06-11T06:54:12.4081363Z updating: app/enums/mail/mail.py (deflated 77%)
2025-06-11T06:54:12.4081838Z updating: app/enums/document/ (stored 0%)
2025-06-11T06:54:12.4082975Z updating: app/enums/document/document.py (deflated 70%)
2025-06-11T06:54:12.4083428Z updating: app/enums/request/ (stored 0%)
2025-06-11T06:54:12.4084884Z updating: app/enums/request/status.py (deflated 43%)
2025-06-11T06:54:12.4085360Z updating: app/enums/request/action.py (deflated 53%)
2025-06-11T06:54:12.4086475Z updating: app/enums/coc/ (stored 0%)
2025-06-11T06:54:12.4086702Z updating: app/enums/coc/coc.py (deflated 43%)
2025-06-11T06:54:12.4088242Z updating: app/enums/utils.py (deflated 17%)
2025-06-11T06:54:12.4088645Z updating: app/enums/entities.py (deflated 70%)
2025-06-11T06:54:12.4089107Z updating: app/enums/__init__.py (stored 0%)
2025-06-11T06:54:12.4090975Z updating: app/enums/user/ (stored 0%)
2025-06-11T06:54:12.4091581Z updating: app/enums/user/resources.py (deflated 56%)
2025-06-11T06:54:12.4092535Z updating: app/static/ (stored 0%)
2025-06-11T06:54:12.4092776Z updating: app/static/style.css (deflated 61%)
2025-06-11T06:54:12.4093000Z updating: app/auth/ (stored 0%)
2025-06-11T06:54:12.4093232Z updating: app/auth/auth_config.py (deflated 56%)
2025-06-11T06:54:12.4102565Z updating: app/auth/auth.py (deflated 72%)
2025-06-11T06:54:12.4102885Z updating: app/utils.py (deflated 64%)
2025-06-11T06:54:12.4103118Z updating: app/resources/ (stored 0%)
2025-06-11T06:54:12.4103383Z updating: app/resources/mail.py (deflated 71%)
2025-06-11T06:54:12.4107315Z updating: app/resources/company_card.py (deflated 73%)
2025-06-11T06:54:12.4108134Z updating: app/resources/report.py (deflated 74%)
2025-06-11T06:54:12.4113920Z updating: app/resources/request.py (deflated 81%)
2025-06-11T06:54:12.4118269Z updating: app/resources/rebuy_document.py (deflated 69%)
2025-06-11T06:54:12.4121491Z updating: app/resources/company.py (deflated 78%)
2025-06-11T06:54:12.4122538Z updating: app/resources/person.py (deflated 74%)
2025-06-11T06:54:12.4126570Z updating: app/resources/health.py (deflated 58%)
2025-06-11T06:54:12.4129189Z updating: app/resources/not_found.py (deflated 53%)
2025-06-11T06:54:12.4130210Z updating: app/resources/__init__.py (deflated 76%)
2025-06-11T06:54:12.4130469Z updating: app/resources/shares.py (deflated 73%)
2025-06-11T06:54:12.4130710Z updating: app/resources/coc.py (deflated 68%)
2025-06-11T06:54:12.4134091Z updating: app/resources/document.py (deflated 76%)
2025-06-11T06:54:12.4136930Z updating: app/resources/financial_statement.py (deflated 80%)
2025-06-11T06:54:12.4140836Z updating: app/resources/balance.py (deflated 79%)
2025-06-11T06:54:12.4142314Z updating: app/resources/person_report.py (deflated 74%)
2025-06-11T06:54:12.4146183Z updating: app/resources/legal_procedures_deed.py (deflated 74%)
2025-06-11T06:54:12.4149843Z updating: app/resources/shareholders.py (deflated 74%)
2025-06-11T06:54:12.4152805Z updating: app/resources/user.py (deflated 64%)
2025-06-11T06:54:12.4158060Z updating: app/resources/visura.py (deflated 76%)
2025-06-11T06:54:12.4161957Z updating: app/resources/representative_card.py (deflated 75%)
2025-06-11T06:54:12.4167085Z updating: app/config.py (deflated 68%)
2025-06-11T06:54:12.4168888Z updating: app/routes/ (stored 0%)
2025-06-11T06:54:12.4171328Z updating: app/routes/home.py (deflated 62%)
2025-06-11T06:54:12.4171771Z updating: app/templates/ (stored 0%)
2025-06-11T06:54:12.4173037Z updating: app/templates/home.html (deflated 31%)
2025-06-11T06:54:12.4180685Z updating: app/templates/email.html (deflated 61%)
2025-06-11T06:54:12.4183736Z updating: app/validate.py (deflated 73%)
2025-06-11T06:54:12.4184953Z updating: app/extensions.py (deflated 67%)
2025-06-11T06:54:12.4186803Z updating: app/assets/ (stored 0%)
2025-06-11T06:54:12.4187409Z updating: app/assets/certs/ (stored 0%)
2025-06-11T06:54:12.4187962Z updating: app/assets/certs/localhost.crt (deflated 24%)
2025-06-11T06:54:12.4190271Z updating: app/assets/certs/spartaxtest.deloitte.it.pfx (deflated 24%)
2025-06-11T06:54:12.4190857Z updating: app/assets/certs/localhost.key (deflated 23%)
2025-06-11T06:54:12.4191252Z updating: app/storage/ (stored 0%)
2025-06-11T06:54:12.4194133Z updating: app/storage/azstorage.py (deflated 68%)
2025-06-11T06:54:12.4197198Z updating: app/cache.py (deflated 76%)
2025-06-11T06:54:12.5089121Z updating: poetry.lock (deflated 70%)
2025-06-11T06:54:12.5254462Z 
2025-06-11T06:54:12.5342597Z ##[section]Finishing: Environment setup & Run DB Migration with Poetry
2025-06-11T06:54:12.5364783Z ##[section]Starting: PublishPipelineArtifact
2025-06-11T06:54:12.5372530Z ==============================================================================
2025-06-11T06:54:12.5372676Z Task         : Publish Pipeline Artifacts
2025-06-11T06:54:12.5372782Z Description  : Publish (upload) a file or directory as a named artifact for the current run
2025-06-11T06:54:12.5372910Z Version      : 1.242.0
2025-06-11T06:54:12.5372985Z Author       : Microsoft Corporation
2025-06-11T06:54:12.5373086Z Help         : https://docs.microsoft.com/azure/devops/pipelines/tasks/utility/publish-pipeline-artifact
2025-06-11T06:54:12.5373217Z ==============================================================================
2025-06-11T06:54:12.7884120Z Artifact name input: drop
2025-06-11T06:54:12.7989285Z Uploading pipeline artifact from /home/ogourari/azagent-api/_work/3/drop/application.zip for build #933
2025-06-11T06:54:13.3449111Z Using default max parallelism.
2025-06-11T06:54:13.3455014Z Max dedup parallelism: 192
2025-06-11T06:54:13.3468499Z DomainId: 0
2025-06-11T06:54:13.4626060Z ApplicationInsightsTelemetrySender will correlate events with X-TFS-Session 8a6d25df-4387-4368-9ed9-7c6678dbea14
2025-06-11T06:54:13.4725608Z Hashtype: Dedup1024K
2025-06-11T06:54:13.4883795Z DedupManifestArtifactClient will correlate http requests with X-TFS-Session 8a6d25df-4387-4368-9ed9-7c6678dbea14
2025-06-11T06:54:13.9203555Z 1 files processed.
2025-06-11T06:54:13.9214241Z Processed 1 files from /home/ogourari/azagent-api/_work/3/drop successfully.
2025-06-11T06:54:16.3560337Z Uploaded 3,296,984 out of 67,121,526 bytes
2025-06-11T06:54:16.3561959Z Content upload is done!
2025-06-11T06:54:16.3583121Z 
2025-06-11T06:54:16.3584611Z Content upload statistics:
2025-06-11T06:54:16.3586351Z Total Content: 134.2 MB
2025-06-11T06:54:16.3586733Z Physical Content Uploaded: 2.2 MB
2025-06-11T06:54:16.3588345Z Logical Content Uploaded: 3.3 MB
2025-06-11T06:54:16.3588816Z Compression Saved: 1.1 MB
2025-06-11T06:54:16.3593538Z Deduplication Saved: 130.9 MB
2025-06-11T06:54:16.3593751Z Number of Chunks Uploaded: 4
2025-06-11T06:54:16.3595541Z Total Number of Chunks: 154
2025-06-11T06:54:16.3595648Z 
2025-06-11T06:54:16.6099625Z Associated artifact 320 with build 933
2025-06-11T06:54:17.6015771Z ApplicationInsightsTelemetrySender correlated 2 events with X-TFS-Session 8a6d25df-4387-4368-9ed9-7c6678dbea14
2025-06-11T06:54:17.6020985Z Uploading pipeline artifact finished.
2025-06-11T06:54:17.6204363Z ##[section]Finishing: PublishPipelineArtifact
2025-06-11T06:54:17.6227290Z ##[section]Starting: Checkout spartax-api@stable to s
2025-06-11T06:54:17.6231790Z ==============================================================================
2025-06-11T06:54:17.6231930Z Task         : Get sources
2025-06-11T06:54:17.6232013Z Description  : Get sources from a repository. Supports Git, TfsVC, and SVN repositories.
2025-06-11T06:54:17.6232130Z Version      : 1.0.0
2025-06-11T06:54:17.6232203Z Author       : Microsoft
2025-06-11T06:54:17.6232307Z Help         : [More Information](https://go.microsoft.com/fwlink/?LinkId=798199)
2025-06-11T06:54:17.6232409Z ==============================================================================
2025-06-11T06:54:17.8722224Z Cleaning any cached credential from repository: spartax-api (Git)
2025-06-11T06:54:17.8835158Z ##[section]Finishing: Checkout spartax-api@stable to s
2025-06-11T06:54:17.8860647Z ##[section]Starting: Finalize Job
2025-06-11T06:54:17.8869813Z Cleaning up task key
2025-06-11T06:54:17.8871038Z Start cleaning up orphan processes.
2025-06-11T06:54:17.9184011Z ##[section]Finishing: Finalize Job
2025-06-11T06:54:17.9209505Z ##[section]Finishing: Setup Python, Poetry and App Package_Deploy_AZU382ITN18001
